outputs/quarterly_pull/2026-07-01T053352Z/contribution_allocations.csv

run_id,retrieval_started_at_utc,retrieval_completed_at_utc,score_session,source_snapshot,eligible_count,scored_count,code_commit,configuration_sha256,output_manifest_sha256,contribution_amount,ticker,portfolio_rank,latest_close,current_value,target_value_after_contribution,underweight,allocation,illustrative_fractional_shares,method,residual_cash
2026-07-01T053352Z,2026-07-01T05:33:52.980988+00:00,2026-07-01T07:21:20.090043+00:00,2026-06-30,data/prospective/daily_qvp/snapshots/2026-07-01T053352Z/raw,1081,1043,144e01281e848a2a4c711cb0058eddc75099bb40,d3881a1328862a39dc4af32e15c4826237a09adca2da7038eafb5659ddb68bb4,8bda06ce0251beedd6a5f2cd61a08ef37682841102d3b9d86a1ab602640baf4e,250.0,NTCT,1,43.54999923706055,0.0,8.333333333333334,8.333333333333334,83.33333333333334,1.9135094097181438,up_to_three_largest_underweights,0.0
2026-07-01T053352Z,2026-07-01T05:33:52.980988+00:00,2026-07-01T07:21:20.090043+00:00,2026-06-30,data/prospective/daily_qvp/snapshots/2026-07-01T053352Z/raw,1081,1043,144e01281e848a2a4c711cb0058eddc75099bb40,d3881a1328862a39dc4af32e15c4826237a09adca2da7038eafb5659ddb68bb4,8bda06ce0251beedd6a5f2cd61a08ef37682841102d3b9d86a1ab602640baf4e,250.0,CRUS,2,148.52999877929688,0.0,8.333333333333334,8.333333333333334,83.33333333333334,0.5610538882260391,up_to_three_largest_underweights,0.0
2026-07-01T053352Z,2026-07-01T05:33:52.980988+00:00,2026-07-01T07:21:20.090043+00:00,2026-06-30,data/prospective/daily_qvp/snapshots/2026-07-01T053352Z/raw,1081,1043,144e01281e848a2a4c711cb0058eddc75099bb40,d3881a1328862a39dc4af32e15c4826237a09adca2da7038eafb5659ddb68bb4,8bda06ce0251beedd6a5f2cd61a08ef37682841102d3b9d86a1ab602640baf4e,250.0,VISN,3,12.779999732971191,0.0,8.333333333333334,8.333333333333334,83.33333333333334,6.520605248397715,up_to_three_largest_underweights,0.0
2026-07-01T053352Z,2026-07-01T05:33:52.980988+00:00,2026-07-01T07:21:20.090043+00:00,2026-06-30,data/prospective/daily_qvp/snapshots/2026-07-01T053352Z/raw,1081,1043,144e01281e848a2a4c711cb0058eddc75099bb40,d3881a1328862a39dc4af32e15c4826237a09adca2da7038eafb5659ddb68bb4,8bda06ce0251beedd6a5f2cd61a08ef37682841102d3b9d86a1ab602640baf4e,250.0,NTCT,1,43.54999923706055,0.0,8.333333333333334,8.333333333333334,250.0,5.740528229154431,single_largest_underweight_alternative,0.0
2026-07-01T053352Z,2026-07-01T05:33:52.980988+00:00,2026-07-01T07:21:20.090043+00:00,2026-06-30,data/prospective/daily_qvp/snapshots/2026-07-01T053352Z/raw,1081,1043,144e01281e848a2a4c711cb0058eddc75099bb40,d3881a1328862a39dc4af32e15c4826237a09adca2da7038eafb5659ddb68bb4,8bda06ce0251beedd6a5f2cd61a08ef37682841102d3b9d86a1ab602640baf4e,500.0,NTCT,1,43.54999923706055,0.0,16.666666666666668,16.666666666666668,166.66666666666669,3.8270188194362875,up_to_three_largest_underweights,0.0
2026-07-01T053352Z,2026-07-01T05:33:52.980988+00:00,2026-07-01T07:21:20.090043+00:00,2026-06-30,data/prospective/daily_qvp/snapshots/2026-07-01T053352Z/raw,1081,1043,144e01281e848a2a4c711cb0058eddc75099bb40,d3881a1328862a39dc4af32e15c4826237a09adca2da7038eafb5659ddb68bb4,8bda06ce0251beedd6a5f2cd61a08ef37682841102d3b9d86a1ab602640baf4e,500.0,CRUS,2,148.52999877929688,0.0,16.666666666666668,16.666666666666668,166.66666666666669,1.1221077764520782,up_to_three_largest_underweights,0.0
2026-07-01T053352Z,2026-07-01T05:33:52.980988+00:00,2026-07-01T07:21:20.090043+00:00,2026-06-30,data/prospective/daily_qvp/snapshots/2026-07-01T053352Z/raw,1081,1043,144e01281e848a2a4c711cb0058eddc75099bb40,d3881a1328862a39dc4af32e15c4826237a09adca2da7038eafb5659ddb68bb4,8bda06ce0251beedd6a5f2cd61a08ef37682841102d3b9d86a1ab602640baf4e,500.0,VISN,3,12.779999732971191,0.0,16.666666666666668,16.666666666666668,166.66666666666669,13.04121049679543,up_to_three_largest_underweights,0.0
2026-07-01T053352Z,2026-07-01T05:33:52.980988+00:00,2026-07-01T07:21:20.090043+00:00,2026-06-30,data/prospective/daily_qvp/snapshots/2026-07-01T053352Z/raw,1081,1043,144e01281e848a2a4c711cb0058eddc75099bb40,d3881a1328862a39dc4af32e15c4826237a09adca2da7038eafb5659ddb68bb4,8bda06ce0251beedd6a5f2cd61a08ef37682841102d3b9d86a1ab602640baf4e,500.0,NTCT,1,43.54999923706055,0.0,16.666666666666668,16.666666666666668,500.0,11.481056458308862,single_largest_underweight_alternative,0.0
2026-07-01T053352Z,2026-07-01T05:33:52.980988+00:00,2026-07-01T07:21:20.090043+00:00,2026-06-30,data/prospective/daily_qvp/snapshots/2026-07-01T053352Z/raw,1081,1043,144e01281e848a2a4c711cb0058eddc75099bb40,d3881a1328862a39dc4af32e15c4826237a09adca2da7038eafb5659ddb68bb4,8bda06ce0251beedd6a5f2cd61a08ef37682841102d3b9d86a1ab602640baf4e,1000.0,NTCT,1,43.54999923706055,0.0,33.333333333333336,33.333333333333336,333.33333333333337,7.654037638872575,up_to_three_largest_underweights,0.0
2026-07-01T053352Z,2026-07-01T05:33:52.980988+00:00,2026-07-01T07:21:20.090043+00:00,2026-06-30,data/prospective/daily_qvp/snapshots/2026-07-01T053352Z/raw,1081,1043,144e01281e848a2a4c711cb0058eddc75099bb40,d3881a1328862a39dc4af32e15c4826237a09adca2da7038eafb5659ddb68bb4,8bda06ce0251beedd6a5f2cd61a08ef37682841102d3b9d86a1ab602640baf4e,1000.0,CRUS,2,148.52999877929688,0.0,33.333333333333336,33.333333333333336,333.33333333333337,2.2442155529041563,up_to_three_largest_underweights,0.0
2026-07-01T053352Z,2026-07-01T05:33:52.980988+00:00,2026-07-01T07:21:20.090043+00:00,2026-06-30,data/prospective/daily_qvp/snapshots/2026-07-01T053352Z/raw,1081,1043,144e01281e848a2a4c711cb0058eddc75099bb40,d3881a1328862a39dc4af32e15c4826237a09adca2da7038eafb5659ddb68bb4,8bda06ce0251beedd6a5f2cd61a08ef37682841102d3b9d86a1ab602640baf4e,1000.0,VISN,3,12.779999732971191,0.0,33.333333333333336,33.333333333333336,333.33333333333337,26.08242099359086,up_to_three_largest_underweights,0.0
2026-07-01T053352Z,2026-07-01T05:33:52.980988+00:00,2026-07-01T07:21:20.090043+00:00,2026-06-30,data/prospective/daily_qvp/snapshots/2026-07-01T053352Z/raw,1081,1043,144e01281e848a2a4c711cb0058eddc75099bb40,d3881a1328862a39dc4af32e15c4826237a09adca2da7038eafb5659ddb68bb4,8bda06ce0251beedd6a5f2cd61a08ef37682841102d3b9d86a1ab602640baf4e,1000.0,NTCT,1,43.54999923706055,0.0,33.333333333333336,33.333333333333336,1000.0,22.962112916617723,single_largest_underweight_alternative,0.0
2026-07-01T053352Z,2026-07-01T05:33:52.980988+00:00,2026-07-01T07:21:20.090043+00:00,2026-06-30,data/prospective/daily_qvp/snapshots/2026-07-01T053352Z/raw,1081,1043,144e01281e848a2a4c711cb0058eddc75099bb40,d3881a1328862a39dc4af32e15c4826237a09adca2da7038eafb5659ddb68bb4,8bda06ce0251beedd6a5f2cd61a08ef37682841102d3b9d86a1ab602640baf4e,5000.0,NTCT,1,43.54999923706055,0.0,166.66666666666666,166.66666666666666,1666.6666666666665,38.270188194362866,up_to_three_largest_underweights,0.0
2026-07-01T053352Z,2026-07-01T05:33:52.980988+00:00,2026-07-01T07:21:20.090043+00:00,2026-06-30,data/prospective/daily_qvp/snapshots/2026-07-01T053352Z/raw,1081,1043,144e01281e848a2a4c711cb0058eddc75099bb40,d3881a1328862a39dc4af32e15c4826237a09adca2da7038eafb5659ddb68bb4,8bda06ce0251beedd6a5f2cd61a08ef37682841102d3b9d86a1ab602640baf4e,5000.0,CRUS,2,148.52999877929688,0.0,166.66666666666666,166.66666666666666,1666.6666666666665,11.221077764520778,up_to_three_largest_underweights,0.0
2026-07-01T053352Z,2026-07-01T05:33:52.980988+00:00,2026-07-01T07:21:20.090043+00:00,2026-06-30,data/prospective/daily_qvp/snapshots/2026-07-01T053352Z/raw,1081,1043,144e01281e848a2a4c711cb0058eddc75099bb40,d3881a1328862a39dc4af32e15c4826237a09adca2da7038eafb5659ddb68bb4,8bda06ce0251beedd6a5f2cd61a08ef37682841102d3b9d86a1ab602640baf4e,5000.0,VISN,3,12.779999732971191,0.0,166.66666666666666,166.66666666666666,1666.6666666666665,130.41210496795426,up_to_three_largest_underweights,0.0
2026-07-01T053352Z,2026-07-01T05:33:52.980988+00:00,2026-07-01T07:21:20.090043+00:00,2026-06-30,data/prospective/daily_qvp/snapshots/2026-07-01T053352Z/raw,1081,1043,144e01281e848a2a4c711cb0058eddc75099bb40,d3881a1328862a39dc4af32e15c4826237a09adca2da7038eafb5659ddb68bb4,8bda06ce0251beedd6a5f2cd61a08ef37682841102d3b9d86a1ab602640baf4e,5000.0,NTCT,1,43.54999923706055,0.0,166.66666666666666,166.66666666666666,5000.0,114.81056458308862,single_largest_underweight_alternative,0.0

outputs/quarterly_pull/2026-07-01T053352Z/report.md

## Contribution illustrations

- USD 0: no allocation; contribution is zero; residual cash $0.00
- USD 250: NTCT $83.33 (1.9135 shares), CRUS $83.33 (0.5611 shares), VISN $83.33 (6.5206 shares); residual cash $-0.00
- USD 500: NTCT $166.67 (3.8270 shares), CRUS $166.67 (1.1221 shares), VISN $166.67 (13.0412 shares); residual cash $-0.00
- USD 1,000: NTCT $333.33 (7.6540 shares), CRUS $333.33 (2.2442 shares), VISN $333.33 (26.0824 shares); residual cash $-0.00
- USD 5,000: NTCT $1,666.67 (38.2702 shares), CRUS $1,666.67 (11.2211 shares), VISN $1,666.67 (130.4121 shares); residual cash $0.00