outputs/daily_qvp_runs/2026-06-22T172514Z/contribution_allocations.csv

run_id,retrieval_started_at_utc,retrieval_completed_at_utc,score_session,source_snapshot,eligible_count,scored_count,code_commit,configuration_sha256,output_manifest_sha256,contribution_amount,ticker,portfolio_rank,latest_close,current_value,target_value_after_contribution,underweight,allocation,illustrative_fractional_shares,method,residual_cash
2026-06-22T172514Z,2026-06-22T17:25:14.461566+00:00,2026-06-22T18:43:27.580303+00:00,2026-06-18,data/prospective/daily_qvp/snapshots/2026-06-22T172514Z/raw,1069,1033,72af374d04e901f3a678712add4dd00b5ebe3982,d3881a1328862a39dc4af32e15c4826237a09adca2da7038eafb5659ddb68bb4,bc5bfb4dae7f730ab765e07368bea9a7335e09f5fd36468db78e6337fae502d2,250.0,NTCT,1,39.66999816894531,0.0,8.333333333333334,8.333333333333334,83.33333333333334,2.1006639067245736,up_to_three_largest_underweights,0.0
2026-06-22T172514Z,2026-06-22T17:25:14.461566+00:00,2026-06-22T18:43:27.580303+00:00,2026-06-18,data/prospective/daily_qvp/snapshots/2026-06-22T172514Z/raw,1069,1033,72af374d04e901f3a678712add4dd00b5ebe3982,d3881a1328862a39dc4af32e15c4826237a09adca2da7038eafb5659ddb68bb4,bc5bfb4dae7f730ab765e07368bea9a7335e09f5fd36468db78e6337fae502d2,250.0,CRUS,2,165.2899932861328,0.0,8.333333333333334,8.333333333333334,83.33333333333334,0.5041644184053862,up_to_three_largest_underweights,0.0
2026-06-22T172514Z,2026-06-22T17:25:14.461566+00:00,2026-06-22T18:43:27.580303+00:00,2026-06-18,data/prospective/daily_qvp/snapshots/2026-06-22T172514Z/raw,1069,1033,72af374d04e901f3a678712add4dd00b5ebe3982,d3881a1328862a39dc4af32e15c4826237a09adca2da7038eafb5659ddb68bb4,bc5bfb4dae7f730ab765e07368bea9a7335e09f5fd36468db78e6337fae502d2,250.0,RAMP,3,37.7400016784668,0.0,8.333333333333334,8.333333333333334,83.33333333333334,2.2080903451808958,up_to_three_largest_underweights,0.0
2026-06-22T172514Z,2026-06-22T17:25:14.461566+00:00,2026-06-22T18:43:27.580303+00:00,2026-06-18,data/prospective/daily_qvp/snapshots/2026-06-22T172514Z/raw,1069,1033,72af374d04e901f3a678712add4dd00b5ebe3982,d3881a1328862a39dc4af32e15c4826237a09adca2da7038eafb5659ddb68bb4,bc5bfb4dae7f730ab765e07368bea9a7335e09f5fd36468db78e6337fae502d2,250.0,NTCT,1,39.66999816894531,0.0,8.333333333333334,8.333333333333334,250.0,6.30199172017372,single_largest_underweight_alternative,0.0
2026-06-22T172514Z,2026-06-22T17:25:14.461566+00:00,2026-06-22T18:43:27.580303+00:00,2026-06-18,data/prospective/daily_qvp/snapshots/2026-06-22T172514Z/raw,1069,1033,72af374d04e901f3a678712add4dd00b5ebe3982,d3881a1328862a39dc4af32e15c4826237a09adca2da7038eafb5659ddb68bb4,bc5bfb4dae7f730ab765e07368bea9a7335e09f5fd36468db78e6337fae502d2,500.0,NTCT,1,39.66999816894531,0.0,16.666666666666668,16.666666666666668,166.66666666666669,4.201327813449147,up_to_three_largest_underweights,0.0
2026-06-22T172514Z,2026-06-22T17:25:14.461566+00:00,2026-06-22T18:43:27.580303+00:00,2026-06-18,data/prospective/daily_qvp/snapshots/2026-06-22T172514Z/raw,1069,1033,72af374d04e901f3a678712add4dd00b5ebe3982,d3881a1328862a39dc4af32e15c4826237a09adca2da7038eafb5659ddb68bb4,bc5bfb4dae7f730ab765e07368bea9a7335e09f5fd36468db78e6337fae502d2,500.0,CRUS,2,165.2899932861328,0.0,16.666666666666668,16.666666666666668,166.66666666666669,1.0083288368107723,up_to_three_largest_underweights,0.0
2026-06-22T172514Z,2026-06-22T17:25:14.461566+00:00,2026-06-22T18:43:27.580303+00:00,2026-06-18,data/prospective/daily_qvp/snapshots/2026-06-22T172514Z/raw,1069,1033,72af374d04e901f3a678712add4dd00b5ebe3982,d3881a1328862a39dc4af32e15c4826237a09adca2da7038eafb5659ddb68bb4,bc5bfb4dae7f730ab765e07368bea9a7335e09f5fd36468db78e6337fae502d2,500.0,RAMP,3,37.7400016784668,0.0,16.666666666666668,16.666666666666668,166.66666666666669,4.4161806903617915,up_to_three_largest_underweights,0.0
2026-06-22T172514Z,2026-06-22T17:25:14.461566+00:00,2026-06-22T18:43:27.580303+00:00,2026-06-18,data/prospective/daily_qvp/snapshots/2026-06-22T172514Z/raw,1069,1033,72af374d04e901f3a678712add4dd00b5ebe3982,d3881a1328862a39dc4af32e15c4826237a09adca2da7038eafb5659ddb68bb4,bc5bfb4dae7f730ab765e07368bea9a7335e09f5fd36468db78e6337fae502d2,500.0,NTCT,1,39.66999816894531,0.0,16.666666666666668,16.666666666666668,500.0,12.60398344034744,single_largest_underweight_alternative,0.0
2026-06-22T172514Z,2026-06-22T17:25:14.461566+00:00,2026-06-22T18:43:27.580303+00:00,2026-06-18,data/prospective/daily_qvp/snapshots/2026-06-22T172514Z/raw,1069,1033,72af374d04e901f3a678712add4dd00b5ebe3982,d3881a1328862a39dc4af32e15c4826237a09adca2da7038eafb5659ddb68bb4,bc5bfb4dae7f730ab765e07368bea9a7335e09f5fd36468db78e6337fae502d2,1000.0,NTCT,1,39.66999816894531,0.0,33.333333333333336,33.333333333333336,333.33333333333337,8.402655626898294,up_to_three_largest_underweights,0.0
2026-06-22T172514Z,2026-06-22T17:25:14.461566+00:00,2026-06-22T18:43:27.580303+00:00,2026-06-18,data/prospective/daily_qvp/snapshots/2026-06-22T172514Z/raw,1069,1033,72af374d04e901f3a678712add4dd00b5ebe3982,d3881a1328862a39dc4af32e15c4826237a09adca2da7038eafb5659ddb68bb4,bc5bfb4dae7f730ab765e07368bea9a7335e09f5fd36468db78e6337fae502d2,1000.0,CRUS,2,165.2899932861328,0.0,33.333333333333336,33.333333333333336,333.33333333333337,2.0166576736215447,up_to_three_largest_underweights,0.0
2026-06-22T172514Z,2026-06-22T17:25:14.461566+00:00,2026-06-22T18:43:27.580303+00:00,2026-06-18,data/prospective/daily_qvp/snapshots/2026-06-22T172514Z/raw,1069,1033,72af374d04e901f3a678712add4dd00b5ebe3982,d3881a1328862a39dc4af32e15c4826237a09adca2da7038eafb5659ddb68bb4,bc5bfb4dae7f730ab765e07368bea9a7335e09f5fd36468db78e6337fae502d2,1000.0,RAMP,3,37.7400016784668,0.0,33.333333333333336,33.333333333333336,333.33333333333337,8.832361380723583,up_to_three_largest_underweights,0.0
2026-06-22T172514Z,2026-06-22T17:25:14.461566+00:00,2026-06-22T18:43:27.580303+00:00,2026-06-18,data/prospective/daily_qvp/snapshots/2026-06-22T172514Z/raw,1069,1033,72af374d04e901f3a678712add4dd00b5ebe3982,d3881a1328862a39dc4af32e15c4826237a09adca2da7038eafb5659ddb68bb4,bc5bfb4dae7f730ab765e07368bea9a7335e09f5fd36468db78e6337fae502d2,1000.0,NTCT,1,39.66999816894531,0.0,33.333333333333336,33.333333333333336,1000.0,25.20796688069488,single_largest_underweight_alternative,0.0
2026-06-22T172514Z,2026-06-22T17:25:14.461566+00:00,2026-06-22T18:43:27.580303+00:00,2026-06-18,data/prospective/daily_qvp/snapshots/2026-06-22T172514Z/raw,1069,1033,72af374d04e901f3a678712add4dd00b5ebe3982,d3881a1328862a39dc4af32e15c4826237a09adca2da7038eafb5659ddb68bb4,bc5bfb4dae7f730ab765e07368bea9a7335e09f5fd36468db78e6337fae502d2,5000.0,NTCT,1,39.66999816894531,0.0,166.66666666666666,166.66666666666666,1666.6666666666665,42.013278134491465,up_to_three_largest_underweights,0.0
2026-06-22T172514Z,2026-06-22T17:25:14.461566+00:00,2026-06-22T18:43:27.580303+00:00,2026-06-18,data/prospective/daily_qvp/snapshots/2026-06-22T172514Z/raw,1069,1033,72af374d04e901f3a678712add4dd00b5ebe3982,d3881a1328862a39dc4af32e15c4826237a09adca2da7038eafb5659ddb68bb4,bc5bfb4dae7f730ab765e07368bea9a7335e09f5fd36468db78e6337fae502d2,5000.0,CRUS,2,165.2899932861328,0.0,166.66666666666666,166.66666666666666,1666.6666666666665,10.083288368107722,up_to_three_largest_underweights,0.0
2026-06-22T172514Z,2026-06-22T17:25:14.461566+00:00,2026-06-22T18:43:27.580303+00:00,2026-06-18,data/prospective/daily_qvp/snapshots/2026-06-22T172514Z/raw,1069,1033,72af374d04e901f3a678712add4dd00b5ebe3982,d3881a1328862a39dc4af32e15c4826237a09adca2da7038eafb5659ddb68bb4,bc5bfb4dae7f730ab765e07368bea9a7335e09f5fd36468db78e6337fae502d2,5000.0,RAMP,3,37.7400016784668,0.0,166.66666666666666,166.66666666666666,1666.6666666666665,44.16180690361791,up_to_three_largest_underweights,0.0
2026-06-22T172514Z,2026-06-22T17:25:14.461566+00:00,2026-06-22T18:43:27.580303+00:00,2026-06-18,data/prospective/daily_qvp/snapshots/2026-06-22T172514Z/raw,1069,1033,72af374d04e901f3a678712add4dd00b5ebe3982,d3881a1328862a39dc4af32e15c4826237a09adca2da7038eafb5659ddb68bb4,bc5bfb4dae7f730ab765e07368bea9a7335e09f5fd36468db78e6337fae502d2,5000.0,NTCT,1,39.66999816894531,0.0,166.66666666666666,166.66666666666666,5000.0,126.0398344034744,single_largest_underweight_alternative,0.0

outputs/final/current_daily_qvp_report.md

## Contribution illustrations

- USD 0: no allocation; contribution is zero; residual cash $0.00
- USD 250: NTCT $83.33 (2.1007 shares), CRUS $83.33 (0.5042 shares), RAMP $83.33 (2.2081 shares); residual cash $-0.00
- USD 500: NTCT $166.67 (4.2013 shares), CRUS $166.67 (1.0083 shares), RAMP $166.67 (4.4162 shares); residual cash $-0.00
- USD 1,000: NTCT $333.33 (8.4027 shares), CRUS $333.33 (2.0167 shares), RAMP $333.33 (8.8324 shares); residual cash $-0.00
- USD 5,000: NTCT $1,666.67 (42.0133 shares), CRUS $1,666.67 (10.0833 shares), RAMP $1,666.67 (44.1618 shares); residual cash $0.00