outputs/quarterly_pull/2026-10-06T142958Z/contribution_allocations.csv

run_id,retrieval_started_at_utc,retrieval_completed_at_utc,score_session,source_snapshot,eligible_count,scored_count,code_commit,configuration_sha256,output_manifest_sha256,contribution_amount,ticker,portfolio_rank,latest_close,current_value,target_value_after_contribution,underweight,allocation,illustrative_fractional_shares,method,residual_cash
2026-10-06T142958Z,2026-10-06T17:18:00.923876+00:00,2026-10-06T17:24:47.586158+00:00,2026-10-05,data/prospective/daily_qvp/snapshots/2026-10-06T142958Z/raw,1049,1014,476a0536c46a788a7630fa9f3e94f5d730de1f8c,d3881a1328862a39dc4af32e15c4826237a09adca2da7038eafb5659ddb68bb4,7194e4af2e31dac8fc23edad49491676d7b802278c45a341c3257fc8203aed7a,250.0,INCY,1,114.12999725341795,0.0,8.333333333333334,8.333333333333334,83.33333333333334,0.73016152929801,up_to_three_largest_underweights,0.0
2026-10-06T142958Z,2026-10-06T17:18:00.923876+00:00,2026-10-06T17:24:47.586158+00:00,2026-10-05,data/prospective/daily_qvp/snapshots/2026-10-06T142958Z/raw,1049,1014,476a0536c46a788a7630fa9f3e94f5d730de1f8c,d3881a1328862a39dc4af32e15c4826237a09adca2da7038eafb5659ddb68bb4,7194e4af2e31dac8fc23edad49491676d7b802278c45a341c3257fc8203aed7a,250.0,RAMP,2,37.709999084472656,0.0,8.333333333333334,8.333333333333334,83.33333333333334,2.2098471322330635,up_to_three_largest_underweights,0.0
2026-10-06T142958Z,2026-10-06T17:18:00.923876+00:00,2026-10-06T17:24:47.586158+00:00,2026-10-05,data/prospective/daily_qvp/snapshots/2026-10-06T142958Z/raw,1049,1014,476a0536c46a788a7630fa9f3e94f5d730de1f8c,d3881a1328862a39dc4af32e15c4826237a09adca2da7038eafb5659ddb68bb4,7194e4af2e31dac8fc23edad49491676d7b802278c45a341c3257fc8203aed7a,250.0,DINO,3,115.22000122070312,0.0,8.333333333333334,8.333333333333334,83.33333333333334,0.7232540570252982,up_to_three_largest_underweights,0.0
2026-10-06T142958Z,2026-10-06T17:18:00.923876+00:00,2026-10-06T17:24:47.586158+00:00,2026-10-05,data/prospective/daily_qvp/snapshots/2026-10-06T142958Z/raw,1049,1014,476a0536c46a788a7630fa9f3e94f5d730de1f8c,d3881a1328862a39dc4af32e15c4826237a09adca2da7038eafb5659ddb68bb4,7194e4af2e31dac8fc23edad49491676d7b802278c45a341c3257fc8203aed7a,250.0,INCY,1,114.12999725341795,0.0,8.333333333333334,8.333333333333334,250.0,2.19048458789403,single_largest_underweight_alternative,0.0
2026-10-06T142958Z,2026-10-06T17:18:00.923876+00:00,2026-10-06T17:24:47.586158+00:00,2026-10-05,data/prospective/daily_qvp/snapshots/2026-10-06T142958Z/raw,1049,1014,476a0536c46a788a7630fa9f3e94f5d730de1f8c,d3881a1328862a39dc4af32e15c4826237a09adca2da7038eafb5659ddb68bb4,7194e4af2e31dac8fc23edad49491676d7b802278c45a341c3257fc8203aed7a,500.0,INCY,1,114.12999725341795,0.0,16.666666666666668,16.666666666666668,166.66666666666669,1.46032305859602,up_to_three_largest_underweights,0.0
2026-10-06T142958Z,2026-10-06T17:18:00.923876+00:00,2026-10-06T17:24:47.586158+00:00,2026-10-05,data/prospective/daily_qvp/snapshots/2026-10-06T142958Z/raw,1049,1014,476a0536c46a788a7630fa9f3e94f5d730de1f8c,d3881a1328862a39dc4af32e15c4826237a09adca2da7038eafb5659ddb68bb4,7194e4af2e31dac8fc23edad49491676d7b802278c45a341c3257fc8203aed7a,500.0,RAMP,2,37.709999084472656,0.0,16.666666666666668,16.666666666666668,166.66666666666669,4.419694264466127,up_to_three_largest_underweights,0.0
2026-10-06T142958Z,2026-10-06T17:18:00.923876+00:00,2026-10-06T17:24:47.586158+00:00,2026-10-05,data/prospective/daily_qvp/snapshots/2026-10-06T142958Z/raw,1049,1014,476a0536c46a788a7630fa9f3e94f5d730de1f8c,d3881a1328862a39dc4af32e15c4826237a09adca2da7038eafb5659ddb68bb4,7194e4af2e31dac8fc23edad49491676d7b802278c45a341c3257fc8203aed7a,500.0,DINO,3,115.22000122070312,0.0,16.666666666666668,16.666666666666668,166.66666666666669,1.4465081140505964,up_to_three_largest_underweights,0.0
2026-10-06T142958Z,2026-10-06T17:18:00.923876+00:00,2026-10-06T17:24:47.586158+00:00,2026-10-05,data/prospective/daily_qvp/snapshots/2026-10-06T142958Z/raw,1049,1014,476a0536c46a788a7630fa9f3e94f5d730de1f8c,d3881a1328862a39dc4af32e15c4826237a09adca2da7038eafb5659ddb68bb4,7194e4af2e31dac8fc23edad49491676d7b802278c45a341c3257fc8203aed7a,500.0,INCY,1,114.12999725341795,0.0,16.666666666666668,16.666666666666668,500.0,4.38096917578806,single_largest_underweight_alternative,0.0
2026-10-06T142958Z,2026-10-06T17:18:00.923876+00:00,2026-10-06T17:24:47.586158+00:00,2026-10-05,data/prospective/daily_qvp/snapshots/2026-10-06T142958Z/raw,1049,1014,476a0536c46a788a7630fa9f3e94f5d730de1f8c,d3881a1328862a39dc4af32e15c4826237a09adca2da7038eafb5659ddb68bb4,7194e4af2e31dac8fc23edad49491676d7b802278c45a341c3257fc8203aed7a,1000.0,INCY,1,114.12999725341795,0.0,33.333333333333336,33.333333333333336,333.33333333333337,2.92064611719204,up_to_three_largest_underweights,0.0
2026-10-06T142958Z,2026-10-06T17:18:00.923876+00:00,2026-10-06T17:24:47.586158+00:00,2026-10-05,data/prospective/daily_qvp/snapshots/2026-10-06T142958Z/raw,1049,1014,476a0536c46a788a7630fa9f3e94f5d730de1f8c,d3881a1328862a39dc4af32e15c4826237a09adca2da7038eafb5659ddb68bb4,7194e4af2e31dac8fc23edad49491676d7b802278c45a341c3257fc8203aed7a,1000.0,RAMP,2,37.709999084472656,0.0,33.333333333333336,33.333333333333336,333.33333333333337,8.839388528932254,up_to_three_largest_underweights,0.0
2026-10-06T142958Z,2026-10-06T17:18:00.923876+00:00,2026-10-06T17:24:47.586158+00:00,2026-10-05,data/prospective/daily_qvp/snapshots/2026-10-06T142958Z/raw,1049,1014,476a0536c46a788a7630fa9f3e94f5d730de1f8c,d3881a1328862a39dc4af32e15c4826237a09adca2da7038eafb5659ddb68bb4,7194e4af2e31dac8fc23edad49491676d7b802278c45a341c3257fc8203aed7a,1000.0,DINO,3,115.22000122070312,0.0,33.333333333333336,33.333333333333336,333.33333333333337,2.893016228101193,up_to_three_largest_underweights,0.0
2026-10-06T142958Z,2026-10-06T17:18:00.923876+00:00,2026-10-06T17:24:47.586158+00:00,2026-10-05,data/prospective/daily_qvp/snapshots/2026-10-06T142958Z/raw,1049,1014,476a0536c46a788a7630fa9f3e94f5d730de1f8c,d3881a1328862a39dc4af32e15c4826237a09adca2da7038eafb5659ddb68bb4,7194e4af2e31dac8fc23edad49491676d7b802278c45a341c3257fc8203aed7a,1000.0,INCY,1,114.12999725341795,0.0,33.333333333333336,33.333333333333336,1000.0,8.76193835157612,single_largest_underweight_alternative,0.0
2026-10-06T142958Z,2026-10-06T17:18:00.923876+00:00,2026-10-06T17:24:47.586158+00:00,2026-10-05,data/prospective/daily_qvp/snapshots/2026-10-06T142958Z/raw,1049,1014,476a0536c46a788a7630fa9f3e94f5d730de1f8c,d3881a1328862a39dc4af32e15c4826237a09adca2da7038eafb5659ddb68bb4,7194e4af2e31dac8fc23edad49491676d7b802278c45a341c3257fc8203aed7a,5000.0,INCY,1,114.12999725341795,0.0,166.66666666666666,166.66666666666666,1666.6666666666665,14.603230585960198,up_to_three_largest_underweights,0.0
2026-10-06T142958Z,2026-10-06T17:18:00.923876+00:00,2026-10-06T17:24:47.586158+00:00,2026-10-05,data/prospective/daily_qvp/snapshots/2026-10-06T142958Z/raw,1049,1014,476a0536c46a788a7630fa9f3e94f5d730de1f8c,d3881a1328862a39dc4af32e15c4826237a09adca2da7038eafb5659ddb68bb4,7194e4af2e31dac8fc23edad49491676d7b802278c45a341c3257fc8203aed7a,5000.0,RAMP,2,37.709999084472656,0.0,166.66666666666666,166.66666666666666,1666.6666666666665,44.196942644661256,up_to_three_largest_underweights,0.0
2026-10-06T142958Z,2026-10-06T17:18:00.923876+00:00,2026-10-06T17:24:47.586158+00:00,2026-10-05,data/prospective/daily_qvp/snapshots/2026-10-06T142958Z/raw,1049,1014,476a0536c46a788a7630fa9f3e94f5d730de1f8c,d3881a1328862a39dc4af32e15c4826237a09adca2da7038eafb5659ddb68bb4,7194e4af2e31dac8fc23edad49491676d7b802278c45a341c3257fc8203aed7a,5000.0,DINO,3,115.22000122070312,0.0,166.66666666666666,166.66666666666666,1666.6666666666665,14.46508114050596,up_to_three_largest_underweights,0.0
2026-10-06T142958Z,2026-10-06T17:18:00.923876+00:00,2026-10-06T17:24:47.586158+00:00,2026-10-05,data/prospective/daily_qvp/snapshots/2026-10-06T142958Z/raw,1049,1014,476a0536c46a788a7630fa9f3e94f5d730de1f8c,d3881a1328862a39dc4af32e15c4826237a09adca2da7038eafb5659ddb68bb4,7194e4af2e31dac8fc23edad49491676d7b802278c45a341c3257fc8203aed7a,5000.0,INCY,1,114.12999725341795,0.0,166.66666666666666,166.66666666666666,5000.0,43.8096917578806,single_largest_underweight_alternative,0.0

outputs/quarterly_pull/2026-10-06T142958Z/report.md

## Contribution illustrations

- USD 0: no allocation; contribution is zero; residual cash $0.00
- USD 250: INCY $83.33 (0.7302 shares), RAMP $83.33 (2.2098 shares), DINO $83.33 (0.7233 shares); residual cash $-0.00
- USD 500: INCY $166.67 (1.4603 shares), RAMP $166.67 (4.4197 shares), DINO $166.67 (1.4465 shares); residual cash $-0.00
- USD 1,000: INCY $333.33 (2.9206 shares), RAMP $333.33 (8.8394 shares), DINO $333.33 (2.8930 shares); residual cash $-0.00
- USD 5,000: INCY $1,666.67 (14.6032 shares), RAMP $1,666.67 (44.1969 shares), DINO $1,666.67 (14.4651 shares); residual cash $0.00